{
  "theme_id": "semiconductors",
  "as_of_utc": "2026-08-10T19:45:00Z",
  "playbook": "F_overextended_no_chase",
  "action": "WAIT",
  "currently_held": false,
  "eligible": false,
  "reason": "The response mode is overextended or exhausted.",
  "previous_state": null,
  "vehicle": "Theme_ETF",
  "invalidation": [
    "A new retest certificate is required."
  ],
  "decision_status": "WAIT",
  "paper_only": true,
  "real_order_created": false
}
